{
  "$schema": "https://spec.jsontemplates.io/schema/2.0/template.json",
  "meta": {
    "name": "DTE General",
    "lang": "es-CL"
  },
  "options": {
    "page": {
      "style": {
        "size": "letter",
        "margin": "5mm"
      }
    }
  },
  "variables": [
    {
      "name": "D",
      "value": "EnvioDTE.SetDTE.DTE.Documento"
    },
    {
      "name": "I",
      "value": "D.Encabezado.IdDoc"
    },
    {
      "name": "E",
      "value": "D.Encabezado.Emisor"
    },
    {
      "name": "R",
      "value": "D.Encabezado.Receptor"
    },
    {
      "name": "T",
      "value": "D.Encabezado.Totales"
    },
    {
      "name": "Trans",
      "value": "D.Encabezado.Transporte"
    }
  ],
  "body": {
    "type": "VerticalLayout",
    "elements": [
      {
        "type": "VerticalLayout",
        "name": "Documento",
        "style": {
          "margin-bottom": "10px"
        },
        "elements": [
          {
            "type": "HorizontalLayout",
            "name": "Cabecera del DTE",
            "style": {
              "margin-bottom": "10px"
            },
            "elements": [
              {
                "type": "VerticalLayout",
                "name": "Datos Emisor",
                "style": {
                  "width": "65%"
                },
                "elements": [
                  {
                    "type": "ImageBlock",
                    "name": "Logo del Emisor",
                    "src": "https://spec.jsontemplates.io/examples/jsontemplates-logo.png",
                    "alt": "Logo del emisor",
                    "style": {
                      "max-width": "50%"
                    }
                  },
                  {
                    "type": "VerticalLayout",
                    "name": "Datos del Emisor",
                    "elements": [
                      {
                        "type": "TextBlock",
                        "text": "{{ E.RznSoc }}",
                        "style": {
                          "font-weight": "bold",
                          "font-size": "24px",
                          "color": "#085294"
                        }
                      },
                      {
                        "type": "MarkdownBlock",
                        "text": "**Giro**: {{ E.GiroEmis }}\n\n**Dirección**: {{ E.DirOrigen }}, {{ E.CmnaOrigen }}, {{ E.CiudadOrigen }}"
                      }
                    ]
                  }
                ]
              },
              {
                "type": "VerticalLayout",
                "name": "Identificación del DTE",
                "style": {
                  "width": "35%"
                },
                "elements": [
                  {
                    "type": "VerticalLayout",
                    "name": "RUT, Tipo DTE y Folio",
                    "style": {
                      "padding": "5px 0",
                      "border": "3px solid #ff0000"
                    },
                    "elements": [
                      {
                        "type": "TextBlock",
                        "text": "RUT: {{ E.RUTEmisor | format_as('jt.l10n.cl.rut') }}",
                        "style": {
                          "text-align": "center",
                          "font-weight": "bold",
                          "color": "#ff0000"
                        }
                      },
                      {
                        "type": "TextBlock",
                        "text": "Tipo de Documento {{ I.TipoDTE }}",
                        "style": {
                          "text-align": "center",
                          "font-weight": "bold",
                          "color": "#ff0000",
                          "margin-top": "15px"
                        }
                      },
                      {
                        "type": "TextBlock",
                        "text": "# {{ I.Folio }}",
                        "style": {
                          "text-align": "center",
                          "font-weight": "bold",
                          "color": "#ff0000",
                          "margin-top": "15px"
                        }
                      }
                    ]
                  },
                  {
                    "type": "VerticalLayout",
                    "name": "Oficina SII",
                    "elements": [
                      {
                        "type": "TextBlock",
                        "text": "SII - SANTA CRUZ",
                        "style": {
                          "text-align": "center",
                          "font-weight": "bold",
                          "color": "#ff0000"
                        }
                      },
                      {
                        "type": "TextBlock",
                        "text": "Empresa de Menor Tamaño",
                        "style": {
                          "text-align": "right",
                          "font-weight": "bold"
                        }
                      }
                    ]
                  }
                ]
              }
            ]
          },
          {
            "type": "HorizontalLayout",
            "name": "Detalles de la Transacción",
            "style": {
              "margin-bottom": "10px"
            },
            "elements": [
              {
                "type": "MarkdownBlock",
                "name": "Datos del Receptor",
                "text": "**Razón social**: {{ R.RznSocRecep }}\n\n**RUT**: {{ R.RUTRecep | format_as('jt.l10n.cl.rut') }}\n\n**Giro**: {{ R.GiroRecep }}\n\n**Dirección**: {{ R.DirRecep }}, {{ R.CmnaRecep }}, {{ R.CiudadRecep }}\n\n**Contacto**: {{ R.Contacto }}\n\n**Correo**: {{ R.CorreoRecep }}",
                "style": {
                  "width": "60%",
                  "margin-bottom": "10px"
                }
              },
              {
                "type": "KeyValueBlock",
                "style": {
                  "width": "40%"
                },
                "rows": [
                  {
                    "label": {
                      "type": "MarkdownBlock",
                      "text": "**Fecha de emisión**:"
                    },
                    "value": {
                      "type": "TextBlock",
                      "text": "{{ I.FchEmis | format_as('jt.l10n.es.date.long') }}"
                    }
                  },
                  {
                    "label": {
                      "type": "MarkdownBlock",
                      "text": "**Fecha de vencimiento**:"
                    },
                    "value": {
                      "type": "TextBlock",
                      "text": "{{ I.FchVenc | format_as('jt.date.short') }}"
                    }
                  },
                  {
                    "label": {
                      "type": "MarkdownBlock",
                      "text": "**Vendedor**:"
                    },
                    "value": {
                      "type": "TextBlock",
                      "text": "{{ E.CdgVendedor }}"
                    }
                  }
                ]
              }
            ]
          },
          {
            "type": "VerticalLayout",
            "style": {
              "border": "1px solid #d1d5db",
              "margin-bottom": "10px",
              "min-height": "300px"
            },
            "elements": [
              {
                "type": "TableBlock",
                "name": "Detalle de Items",
                "thead": {
                  "style": {
                    "background-color": "#f3f4f6",
                    "color": "#000000",
                    "font-size": "13px"
                  }
                },
                "tbody": {
                  "each": {
                    "list": "D.Detalle",
                    "item": "i"
                  }
                },
                "columns": [
                  {
                    "style": {
                      "width": "20%"
                    },
                    "th": {
                      "type": "TextBlock",
                      "text": "Código"
                    },
                    "td": {
                      "type": "TextBlock",
                      "text": "{{ i.CdgItem.VlrCodigo }}"
                    }
                  },
                  {
                    "th": {
                      "type": "TextBlock",
                      "text": "Item"
                    },
                    "td": {
                      "type": "TextBlock",
                      "text": "{{ i.NmbItem }}\n{{ i.DscItem }}",
                      "style": {
                        "white-space": "pre-line"
                      }
                    }
                  },
                  {
                    "style": {
                      "width": "8%"
                    },
                    "th": {
                      "type": "TextBlock",
                      "text": "Cant."
                    },
                    "td": {
                      "type": "TextBlock",
                      "text": "{{ i.QtyItem | format_as('jt.int') }} {{ i.UnmdItem }}",
                      "style": {
                        "text-align": "right"
                      }
                    }
                  },
                  {
                    "style": {
                      "width": "10%"
                    },
                    "th": {
                      "type": "TextBlock",
                      "text": "P. unitario"
                    },
                    "td": {
                      "type": "TextBlock",
                      "text": "{{ i.PrcItem | format_as('jt.int') }}",
                      "style": {
                        "text-align": "right"
                      }
                    }
                  },
                  {
                    "style": {
                      "width": "10%"